{
  "$schema": "https://json-schema.org/draft/2020-12/schema",
  "$id": "qualification-release-verification-receipt.schema.json",
  "title": "OpenAdapt qualification release verification receipt v1",
  "type": "object",
  "additionalProperties": false,
  "required": [
    "schema_version",
    "verification_id_sha256",
    "verdict",
    "evidence_class",
    "target",
    "claim_scope",
    "admission_object_sha256",
    "admission_bundle_object_sha256",
    "admission_id_sha256",
    "release_sha256",
    "artifact_inventory_sha256",
    "release_identity",
    "source_repository",
    "source_repository_id",
    "source_commit",
    "version",
    "tag",
    "draft_release_id",
    "publication_staging_sha256",
    "authority_state_sha256",
    "revocation_state_sha256",
    "signer_registry_sha256",
    "acceptance_summary_object_sha256",
    "acceptance_manifest_object_sha256",
    "decision_receipt_object_sha256",
    "qualification_admission_object_sha256",
    "qualification_admission_id_sha256",
    "workflow_version_id_sha256",
    "workflow_bundle_sha256",
    "admitted_runtime_sha256",
    "verified_at",
    "expires_at",
    "registry_source_commit",
    "registry_revision",
    "registry_head_sha256",
    "trust_state_source_commit"
  ],
  "allOf": [
    {"oneOf": [{"properties": {"source_repository": {"const": "OpenAdaptAI/openadapt-flow"}, "source_repository_id": {"const": "1291376938"}, "tag": {"type": "string", "pattern": "^v(0|[1-9][0-9]{0,9})\\.(0|[1-9][0-9]{0,9})\\.(0|[1-9][0-9]{0,9})(-[0-9A-Za-z]+([.-][0-9A-Za-z]+)*)?$"}}}, {"properties": {"source_repository": {"const": "OpenAdaptAI/OpenAdapt"}, "source_repository_id": {"const": "627024850"}, "tag": {"type": "string", "pattern": "^openadapt-flow-v(0|[1-9][0-9]{0,9})\\.(0|[1-9][0-9]{0,9})\\.(0|[1-9][0-9]{0,9})(-[0-9A-Za-z]+([.-][0-9A-Za-z]+)*)?$"}}}]}
  ],
  "properties": {
    "schema_version": {"const": "openadapt.qualification-release-verification-receipt/v1"},
    "verification_id_sha256": {"$ref": "#/$defs/digest"},
    "verdict": {"const": "verified"},
    "evidence_class": {"const": "remote-safe-synthetic"},
    "target": {"const": "flow"},
    "claim_scope": {"const": "production_flow"},
    "admission_object_sha256": {"$ref": "#/$defs/digest"},
    "admission_bundle_object_sha256": {"$ref": "#/$defs/digest"},
    "admission_id_sha256": {"$ref": "#/$defs/digest"},
    "release_sha256": {"$ref": "#/$defs/digest"},
    "artifact_inventory_sha256": {"$ref": "#/$defs/digest"},
    "release_identity": {"$ref": "qualification-release.schema.json#/$defs/release_identity"},
    "source_repository": {"enum": ["OpenAdaptAI/openadapt-flow", "OpenAdaptAI/OpenAdapt"]},
    "source_repository_id": {"enum": ["1291376938", "627024850"]},
    "source_commit": {"$ref": "#/$defs/commit"},
    "version": {"type": "string", "minLength": 5, "maxLength": 64},
    "tag": {"type": "string", "pattern": "^(openadapt-flow-)?v[0-9]+\\.[0-9]+\\.[0-9]+(?:-[0-9A-Za-z.-]+)?$"},
    "draft_release_id": {"type": "string", "pattern": "^[1-9][0-9]*$"},
    "publication_staging_sha256": {"$ref": "#/$defs/digest"},
    "authority_state_sha256": {"$ref": "#/$defs/digest"},
    "revocation_state_sha256": {"$ref": "#/$defs/digest"},
    "signer_registry_sha256": {"$ref": "#/$defs/digest"},
    "acceptance_summary_object_sha256": {"$ref": "#/$defs/digest"},
    "acceptance_manifest_object_sha256": {"$ref": "#/$defs/digest"},
    "decision_receipt_object_sha256": {"$ref": "#/$defs/digest"},
    "qualification_admission_object_sha256": {"$ref": "#/$defs/digest"},
    "qualification_admission_id_sha256": {"$ref": "#/$defs/digest"},
    "workflow_version_id_sha256": {"$ref": "#/$defs/digest"},
    "workflow_bundle_sha256": {"$ref": "#/$defs/digest"},
    "admitted_runtime_sha256": {"$ref": "#/$defs/digest"},
    "verified_at": {"$ref": "#/$defs/timestamp"},
    "expires_at": {"oneOf": [{"$ref": "#/$defs/timestamp"}, {"type": "null"}]},
    "registry_source_commit": {"$ref": "#/$defs/commit"},
    "registry_revision": {"type": "integer", "minimum": 1},
    "registry_head_sha256": {"$ref": "#/$defs/digest"},
    "trust_state_source_commit": {"$ref": "#/$defs/commit"}
  },
  "$defs": {
    "digest": {"type": "string", "pattern": "^sha256:[0-9a-f]{64}$"},
    "commit": {"type": "string", "pattern": "^[0-9a-f]{40}$"},
    "timestamp": {"type": "string", "format": "date-time", "pattern": "^[0-9]{4}-[0-9]{2}-[0-9]{2}T[0-9]{2}:[0-9]{2}:[0-9]{2}Z$"}
  }
}
