{
  "acceptance_manifest_object_sha256": "sha256:8527aef029e134510c93230547c97a922338d43fb1c9791f638b1e235e0bb92e",
  "acceptance_summary_object_sha256": "sha256:75ccc37ca41f072174a9b639fbd565890cc58ca239efa7eabfe4d9ef4933941b",
  "admission_bundle_object_sha256": "sha256:4a447b61400e23ea403cffb5a02e421cbe070c225ebf7b3af9b9e2acaae40c27",
  "admission_id_sha256": "sha256:09dd21c3fe1cd8df71b4642cb1b828af551a6ebe7ca9d6d8f2949f14d33af2b6",
  "admission_object_sha256": "sha256:56907ca56db4db3be11e4a4c283f2848e7cc00331fe33ab2c12a3a28a4da3061",
  "admitted_runtime_sha256": "sha256:2efa8ff4176c9f108b5325693593ebafbb1949be95c9516b4341f6b0ca1bb707",
  "artifact_inventory_sha256": "sha256:9222ec0d9352666efd2d5a5210a2e3125270a19d48c2983b80a14c0c3e318e79",
  "authority_state_sha256": "sha256:2d46fdb4ce1f61d869a1372cc5ea3f6ea360447a59b0ead3e322bca5afa1dfb8",
  "claim_scope": "production_flow",
  "decision_receipt_object_sha256": "sha256:a2b7f1a0178daf4ddcecc0731cd3d4f57f9822acd945fc9f1c7037821e1cdb2d",
  "draft_release_id": "20",
  "evidence_class": "remote-safe-synthetic",
  "expires_at": "2026-09-03T12:00:00Z",
  "publication_staging_sha256": "sha256:f214d9b3dcc0d6615efcd7d8f15792c34ef967e1f7024f395eb15f0833ebdf24",
  "qualification_admission_id_sha256": "sha256:ce6754aacb52b3c35e81fc1a076195adf0a162ecdacf838cfe1e7649d5664102",
  "qualification_admission_object_sha256": "sha256:2169ccd36de0dd72e4533e35cb918af7c833baaa9ceb6edb3be35a0d708f9b06",
  "registry_head_sha256": "sha256:54998095cc9bc282a25e90b15f12f7135942c29c065bb0ad4e90315a4451cd56",
  "registry_revision": 4,
  "registry_source_commit": "2222222222222222222222222222222222222222",
  "release_identity": {
    "channel": "production",
    "previous_admission_sha256": null,
    "schema_version": "openadapt.monotonic-production-release/v1",
    "sequence": 1
  },
  "release_sha256": "sha256:86f044c13a0edbf8f3adbc7a3092bbc3c9db0401a1c81198ea3a404bd3d80389",
  "revocation_state_sha256": "sha256:dc16dc420de82d166d9fd87c888423fc2e23abb66ebaff46e8564e7a98eb6288",
  "schema_version": "openadapt.qualification-release-verification-receipt/v1",
  "signer_registry_sha256": "sha256:eb46e6483e9a3ee97410a01979e6130c121c8f5f868b984833c8b0903400e78a",
  "source_commit": "eeeeeeeeeeeeeeeeeeeeeeeeeeeeeeeeeeeeeeee",
  "source_repository": "OpenAdaptAI/openadapt-flow",
  "source_repository_id": "1291376938",
  "tag": "v1.35.0",
  "target": "flow",
  "trust_state_source_commit": "2222222222222222222222222222222222222222",
  "verdict": "verified",
  "verification_id_sha256": "sha256:50539886c5f1cc0749896cbafb783260faeac44cad8cf03c310ce9229d773400",
  "verified_at": "2026-08-27T12:00:00Z",
  "version": "1.35.0",
  "workflow_bundle_sha256": "sha256:069b4455df8b54f4f0b741d87ade877e79714fcec7ac5cdfd3235326382a8ab1",
  "workflow_version_id_sha256": "sha256:01bca22076f6ac601820066304d30c83e4f8708dff9c7be3bd1dc818e24d417c"
}
